{
  "schema_version": "2.0",
  "source_id": "anchor360-live",
  "node_id": "sysai-server2",
  "zone_id": "zoneA",
  "timestamp": "2026-10-12T14:15:06.071+09:00",
  "emitted_at": "2026-10-12T14:15:07.302+09:00",
  "model": "yoloworld",
  "model_file": "yolov8x-worldv2.pt",
  "width": 720,
  "height": 720,
  "view": {
    "u_deg": 230.0,
    "v_deg": -36.35,
    "roll_deg": 0
  },
  "coordinate_frame": "anchor360",
  "detections": [
    {
      "id": 1,
      "label": "chair",
      "group": "HARD_OBSTACLE",
      "confidence": 0.412,
      "bbox": [
        301,
        402,
        388,
        515
      ],
      "position": {
        "x": 0.412,
        "y": 0.0,
        "z": 2.135
      },
      "ground_dist_m": 2.174,
      "size_m": {
        "w": 0.43,
        "h": 0.56,
        "d": 0.43
      },
      "ground_clipped": false,
      "wy": -0.27
    }
  ]
}
